{
  "contract_version": "atlas.qa.provider.v1",
  "provider_id": "mock.physical-device",
  "provider_type": "mock",
  "auth_env_vars": [],
  "supported_lenses": [
    "desktop.chromium.real",
    "android.chrome.real",
    "iphone.webkit.real"
  ],
  "artifact_capabilities": [
    "screenshot",
    "console_log",
    "network_log"
  ]
}
